t_id,user_id,t_sentiment,t_stance,t_date,t_text,hashtags
821271524686569472,265390197,positive,other,2017-01-17T08:22:44.000Z,Ian D Smith on BBC confirming the only city in UK the Gov care about is London! Hasn't mentioned any other discussing Brexit #fuckbrexit,['fuckbrexit']
821463103137337344,142775215,negative,remain,2017-01-17T21:04:00.000Z,"When people who voted for Trump and Brexit complain about the consequences... 
#DragQueen #ToldYouSo #StillNoToTrump #FuckBrexit https://t.co/CRwWCGOyWI",['fuckbrexit']
823888845330612224,3881391291,positive,remain,2017-01-24T13:43:02.000Z,"Brexit = Austerity 👍👍 thank you supreme court for defending 🇬🇧 constitution 🇪🇺 #fuckbrexit stay european, stay global",['fuckbrexit']
825260732719697920,526826076,negative,remain,2017-01-28T08:34:25.000Z,Spaceport plans delayed by Brexit #fuckbrexit The damage to science is immense  https://t.co/1NTsuQkfUR,['fuckbrexit']
826529641938767872,23929915,positive,remain,2017-01-31T20:36:37.000Z,"And it reaches the slopes of Italy 🇮🇹🇪🇺🇬🇧
#brexit #fuckbrexit #remain https://t.co/v1ujjMG2Sj https://t.co/zLHird0UlN",['fuckbrexit']
827888717935296512,1339665506,negative,remain,2017-02-04T14:37:06.000Z,Didn't expect an remain protest on Newbury today. #fightthepower #fuckbrexit #strongerin #brexit… https://t.co/7COmQcUumq,['fuckbrexit']
828040287779971072,238934159,negative,remain,2017-02-05T00:39:23.000Z,"@campbellclaret brexit is ludicrous, sad, inward looking and xenophobic. Brexiteers deny it, but its true. #fuckbrexit.",['fuckbrexit']
829763004715659264,28775507,negative,other,2017-02-09T18:44:51.000Z,"Ah, the truth about Brexit. A bullies' charter. What a pathetic, insecure, aggressive and inadequate country Britain is.  #fuckbrexit https://t.co/updIgDCqr6",['fuckbrexit']
829977421927563264,2877010967,positive,remain,2017-02-10T08:56:52.000Z,"@PupMiloNL @Pup_Amp from the point of view of brexit, it's looking pretty familiar. 😒
#fuckbrexit",['fuckbrexit']
833352860318441472,630860546,negative,remain,2017-02-19T16:29:39.000Z,FUCKING BREXIT HAS MADE 24 BUD £15 AT ASDA #fuckbrexit,['fuckbrexit']
837570177206210560,49564459,negative,other,2017-03-03T07:47:46.000Z,"No 10 refuses to budge on Brexit bill, despite heavy defeat in Lords. I'm upgrading my preferred # to #FuckBrexit https://t.co/0soh8qBcs2",['fuckbrexit']
841253533538123776,12307662,neutral,remain,2017-03-13T11:44:06.000Z,#brexit hooray for #scotland #auspol #fuckbrexit,['fuckbrexit']
841256860896309248,12307662,negative,remain,2017-03-13T11:57:20.000Z,#scotland hopefully this will make the #littleenglanders eat shit #brexit #fuckbrexit,['fuckbrexit']
846115322797150208,30207675,negative,remain,2017-03-26T21:43:07.000Z,"Before I go to bed I'd like to say FUCK BREXIT. 
#fuckbrexit",['fuckbrexit']
847017482732888064,20145551,neutral,leave,2017-03-29T09:27:59.000Z,Back from Oslo and putting my watch back 40 years #brexit #fuckbrexit,['fuckbrexit']
847045866145898496,838511592476192640,negative,other,2017-03-29T11:20:46.000Z,"@Robbo87db was a slight over exaggeration, called a joke?... kind of what this whole brexit shit is tbh #Brexit #FuckBrexit",['fuckbrexit']
847132840219164672,2841087635,positive,remain,2017-03-29T17:06:22.000Z,dear theresa may &amp; the tories fuck u &amp; brexit love WotD   #fuckbrexit  #thoushaltnotfollow https://t.co/2qHx5Ffzbl,['fuckbrexit']
847119718133760000,17861691,neutral,other,2017-03-29T16:14:14.000Z,"Just renewed my passport, my @TheGreenParty membership and my subscription to @newint. 💚🌍🌏🌎 #FuckBrexit #Brexit",['fuckbrexit']
847171344252985344,20927846,neutral,other,2017-03-29T19:39:22.000Z,This was basically my song about Brexit before there was a word for Brexit. https://t.co/IIP0JVMdXE #fuckbrexit,['fuckbrexit']
847351269509300224,368843399,neutral,remain,2017-03-30T07:34:20.000Z,And so it begins...https://t.co/SKm8ABZBMd #brexit #brexshit #terriblemistake #fuckbrexit #WTFarewedoing,['fuckbrexit']
847428035678674944,20703347,negative,remain,2017-03-30T12:39:22.000Z,So many people who voted for #Brexit did so incompetently. We are now fucked as a nation. #FuckBrexit #RIPBritain #GreatRepealBill #ByeNHS,['fuckbrexit']
847550314941173760,303404407,negative,remain,2017-03-30T20:45:16.000Z,"FUCK BREXIT #FUCKBREXIT

Sums up my thinking tonight y'all.

Fuck me. Ignorant fucking fools.",['fuckbrexit']
848187044748820480,273652389,positive,remain,2017-04-01T14:55:24.000Z,"Oh how I love this 😆😅 
#Brexit #fuckbrexit

https://t.co/l9sKqOK6A3",['fuckbrexit']
848563890325790720,59516476,negative,remain,2017-04-02T15:52:51.000Z,Is this a late April fools joke? #brexit #stopbrexit #fuckbrexit https://t.co/q3Xnw4HYY2,['fuckbrexit']
848572477315985408,468487089,negative,remain,2017-04-02T16:26:58.000Z,"#brexit - prices in shops have risen again. Idiots want to waste half a £BILLION on new passports, and go to war with Spain.
#FUCKbrexit",['fuckbrexit']
848649668607303680,47945594,neutral,other,2017-04-02T21:33:42.000Z,@sunny_hundal #MichaelHoward's at a 12 and he should be at a 0.000001 #Brexit #Gibraltar #FuckBrexit,['fuckbrexit']
849549353895288832,55199080,negative,remain,2017-04-05T09:08:44.000Z,"@oflynnmep Yes, and he also said that Brexit will be seen a stupid waste of time #fuckbrexit",['fuckbrexit']
849569998737743872,53327958,negative,other,2017-04-05T10:30:46.000Z,"""Brexit is exposing the cowardice of conservatism"" by Nick Cohen #FuckBrexit  https://t.co/pAvU9QFA6e",['fuckbrexit']
850110787398111232,77649883,negative,other,2017-04-06T22:19:40.000Z,Put on #bbcqt. Oops. Brexit gimps managed to forget the only two land borders in their precious sovereignty clawback. Useless. #fuckbrexit,['fuckbrexit']
853208019391459328,84905004,negative,remain,2017-04-15T11:26:58.000Z,@IanColey2112 @atmphillips @eveningperson @RickPoleway Forget history. The future is now. May 4th be with you. The Dark Side of Brexit will feel the force #fuckBrexit,['fuckbrexit']
859650047465664512,749663284815626240,neutral,other,2017-05-03T06:05:17.000Z,@WriterInPyjamas @dontbrexitfixit @fish_in_a_hat I didn't have any followers before Brexit #FuckBrexit,['fuckbrexit']
859685780826050560,780840449963532160,negative,remain,2017-05-03T08:27:16.000Z,Pierre_Proudhon: Brexit could prompt human rights crisis - #fuckbrexit #stopbrexit #ToriesOut https://t.co/GxmO4YIac7,['fuckbrexit']
859695823164145664,780840449963532160,negative,remain,2017-05-03T09:07:11.000Z,Carole_29: RT Pierre_Proudhon: Brexit could prompt human rights crisis - #fuckbrexit #stopbrexit #ToriesOut https://t.co/GxmO4YIac7,['fuckbrexit']
859697081044406272,780840449963532160,negative,remain,2017-05-03T09:12:11.000Z,UFE_Bresistance: RT Pierre_Proudhon: Brexit could prompt human rights crisis - #fuckbrexit #stopbrexit #ToriesOut https://t.co/GxmO4YIac7,['fuckbrexit']
859698392104128512,780840449963532160,negative,remain,2017-05-03T09:17:23.000Z,dawn_woolley: RT Pierre_Proudhon: Brexit could prompt human rights crisis - #fuckbrexit #stopbrexit #ToriesOut https://t.co/GxmO4YIac7,['fuckbrexit']
859715459133919232,20033915,negative,remain,2017-05-03T10:25:12.000Z,#fuckbrexit because Britain no longer comes across as welcoming and inviting. Hate crime has gone up. Sad times #Brexit #brexitcost #Remain,['fuckbrexit']
859809074845798400,780840449963532160,negative,remain,2017-05-03T16:37:12.000Z,AggieHJ: RT Pierre_Proudhon: Brexit could prompt human rights crisis - #fuckbrexit #stopbrexit #ToriesOut https://t.co/GxmO4YIac7,['fuckbrexit']
859811631320223744,780840449963532160,negative,remain,2017-05-03T16:47:22.000Z,Pierre_Proudhon: Our dreams are nightmares of Brexit and fascist politicians #FuckBrexit RemainingKind #ToryDirt… https://t.co/DL03wat99n,['fuckbrexit']
859811640186941440,780840449963532160,negative,other,2017-05-03T16:47:24.000Z,RemainingKind: RT Pierre_Proudhon: Our dreams are nightmares of Brexit and fascist politicians #FuckBrexit  Rem… https://t.co/haRjLD9YNo,['fuckbrexit']
859816704045711360,780840449963532160,negative,other,2017-05-03T17:07:31.000Z,AngryRemainer: RT Pierre_Proudhon: Our dreams are nightmares of Brexit and fascist politicians #FuckBrexit  Rem… https://t.co/fN6cPjKXP0,['fuckbrexit']
859816707136925696,780840449963532160,negative,other,2017-05-03T17:07:32.000Z,AngryRemainer: RT Pierre_Proudhon: Our dreams are nightmares of Brexit and fascist politicians #FuckBrexit  Rem… https://t.co/zCXCk1bC0Q,['fuckbrexit']
859822256586973184,780840449963532160,negative,other,2017-05-03T17:29:35.000Z,maelysdervenn: RT Pierre_Proudhon: Our dreams are nightmares of Brexit and fascist politicians #FuckBrexit  Rem… https://t.co/fN6cPjKXP0,['fuckbrexit']
859869747948736512,780840449963532160,negative,other,2017-05-03T20:38:18.000Z,DavidLance3: RT Pierre_Proudhon: Our dreams are nightmares of Brexit and fascist politicians #FuckBrexit  Remai… https://t.co/NnoJLQhr1c,['fuckbrexit']
859869753359429632,780840449963532160,negative,other,2017-05-03T20:38:19.000Z,maria_hoskins: RT Pierre_Proudhon: Our dreams are nightmares of Brexit and fascist politicians #FuckBrexit  Rem… https://t.co/NnoJLQhr1c,['fuckbrexit']
859871047977508864,780840449963532160,negative,other,2017-05-03T20:43:28.000Z,Herbiv4: RT Pierre_Proudhon: Our dreams are nightmares of Brexit and fascist politicians #FuckBrexit  Remaining… https://t.co/haRjLD9YNo,['fuckbrexit']
859878550412898304,780840449963532160,negative,other,2017-05-03T21:13:16.000Z,NMorris50: RT Pierre_Proudhon: Our dreams are nightmares of Brexit and fascist politicians #FuckBrexit  Remaini… https://t.co/NnoJLQhr1c,['fuckbrexit']
859935186552852480,780840449963532160,negative,other,2017-05-04T00:58:19.000Z,LaureOm: RT Pierre_Proudhon: Our dreams are nightmares of Brexit and fascist politicians #FuckBrexit RemainingK… https://t.co/DL03wat99n,['fuckbrexit']
859935191812505600,780840449963532160,negative,other,2017-05-04T00:58:21.000Z,LaureOm: RT Pierre_Proudhon: Our dreams are nightmares of Brexit and fascist politicians #FuckBrexit  Remaining… https://t.co/9PEKX07m6v,['fuckbrexit']
860021960046239744,780840449963532160,positive,remain,2017-05-04T06:43:08.000Z,RemainingKind: RT Pierre_Proudhon: Voter apathy is the best friend of Brexit… #ToriesOut #stopbrexit #fuckbrexit… https://t.co/2d7pcsZyPi,['fuckbrexit']
860021970905313280,780840449963532160,negative,other,2017-05-04T06:43:10.000Z,russelljj: RT Pierre_Proudhon: Our dreams are nightmares of Brexit and fascist politicians #FuckBrexit  Remaini… https://t.co/NnoJLQhr1c,['fuckbrexit']
860021968409686016,780840449963532160,positive,remain,2017-05-04T06:43:10.000Z,penelopedarby: RT Pierre_Proudhon: Voter apathy is the best friend of Brexit… #ToriesOut #stopbrexit #fuckbrexit… https://t.co/2d7pcsZyPi,['fuckbrexit']
860021973342195712,780840449963532160,negative,other,2017-05-04T06:43:11.000Z,penelopedarby: RT Pierre_Proudhon: Our dreams are nightmares of Brexit and fascist politicians #FuckBrexit  Rem… https://t.co/NnoJLQhr1c,['fuckbrexit']
860034527388893184,780840449963532160,negative,other,2017-05-04T07:33:04.000Z,smsdoc: RT Pierre_Proudhon: Our dreams are nightmares of Brexit and fascist politicians #FuckBrexit  RemainingK… https://t.co/NnoJLQhr1c,['fuckbrexit']
860037153090412544,780840449963532160,negative,other,2017-05-04T07:43:30.000Z,caracal: RT Pierre_Proudhon: Our dreams are nightmares of Brexit and fascist politicians #FuckBrexit  Remaining… https://t.co/NnoJLQhr1c,['fuckbrexit']
860037151261679616,780840449963532160,negative,other,2017-05-04T07:43:30.000Z,nickreeves9876: RT Pierre_Proudhon: Our dreams are nightmares of Brexit and fascist politicians #FuckBrexit  Re… https://t.co/NnoJLQhr1c,['fuckbrexit']
860039429297254400,72684950,negative,remain,2017-05-04T07:52:33.000Z,RT @Pierre_Proudhon Dreams are nightmares of Brexit &amp; fascist politicians #FuckBrexit  #ToryDirtyMoney #StopBrexit #DefeatBrexit17 #GE2017 https://t.co/moF7FoE7fW,['fuckbrexit']
860039586222878720,780840449963532160,negative,other,2017-05-04T07:53:10.000Z,kmqkatie: RT Pierre_Proudhon: Our dreams are nightmares of Brexit and fascist politicians #FuckBrexit  Remainin… https://t.co/NnoJLQhr1c,['fuckbrexit']
860039594670256128,780840449963532160,negative,remain,2017-05-04T07:53:12.000Z,kmqkatie: Our dreams are nightmares of Brexit and fascist politicians #FuckBrexit  RemainingKind #ToryDirtyMoney #StopBrexit #DefeatBrexi…,['fuckbrexit']
860039596616425472,780840449963532160,negative,other,2017-05-04T07:53:13.000Z,kmqkatie: RT Pierre_Proudhon Dreams are nightmares of Brexit &amp; fascist politicians #FuckBrexit  #ToryDirtyMoney … https://t.co/DZjlxM91Qi,['fuckbrexit']
860009594793447424,749663284815626240,neutral,other,2017-05-04T05:54:00.000Z,"@Novembervivi @tony_nog She wants us #silenced. If she wants to make this election about #Brexit, so be it. #FuckBrexit https://t.co/9Cxd3PvaQU",['fuckbrexit']
860042182895513600,780840449963532160,positive,remain,2017-05-04T08:03:29.000Z,BeaufortEve: RT Pierre_Proudhon: Voter apathy is the best friend of Brexit… #ToriesOut #stopbrexit #fuckbrexit  … https://t.co/2d7pcsZyPi,['fuckbrexit']
860042186716573696,780840449963532160,negative,other,2017-05-04T08:03:30.000Z,kmqkatie: RT Pierre_Proudhon: Our dreams are nightmares of Brexit and fascist politicians #FuckBrexit  Remainin… https://t.co/AItHUYuN3E,['fuckbrexit']
860042184799682560,780840449963532160,negative,remain,2017-05-04T08:03:30.000Z,kmqkatie: Our dreams are nightmares of Brexit and fascist politicians #FuckBrexit #ToryDirtyMoney #StopBrexit #De… https://t.co/CDjdazF8pn,['fuckbrexit']
860042216772956160,780840449963532160,positive,remain,2017-05-04T08:03:37.000Z,VeroVero777: RT Pierre_Proudhon: Voter apathy is the best friend of Brexit… #ToriesOut #stopbrexit #fuckbrexit  … https://t.co/2d7pcsZyPi,['fuckbrexit']
860049629714493440,780840449963532160,positive,remain,2017-05-04T08:33:05.000Z,RodNicholl1: RT Pierre_Proudhon: Voter apathy is the best friend of Brexit… #ToriesOut #stopbrexit #fuckbrexit  … https://t.co/2d7pcsZyPi,['fuckbrexit']
860067237213990912,780840449963532160,positive,remain,2017-05-04T09:43:03.000Z,DianaPowves: RT Pierre_Proudhon: Voter apathy is the best friend of Brexit… #ToriesOut #stopbrexit #fuckbrexit  … https://t.co/2d7pcsZyPi,['fuckbrexit']
860069827762892800,780840449963532160,positive,remain,2017-05-04T09:53:20.000Z,gilchrist55: RT Pierre_Proudhon: Voter apathy is the best friend of Brexit… #ToriesOut #stopbrexit #fuckbrexit  … https://t.co/2d7pcsZyPi,['fuckbrexit']
860074909560696832,780840449963532160,neutral,remain,2017-05-04T10:13:32.000Z,Pierre_Proudhon: F@#k Brexit - Use your vote! #stopbrexit #fuckbrexit  RemainingKind BrexitBin #MayThe4thBeWithYou  #LocalElections2017 …,['fuckbrexit']
860077509357993984,780840449963532160,negative,other,2017-05-04T10:23:52.000Z,whypad: RT Pierre_Proudhon: Our dreams are nightmares of Brexit and fascist politicians #FuckBrexit  RemainingK… https://t.co/AItHUYuN3E,['fuckbrexit']
860079877352980480,780840449963532160,negative,other,2017-05-04T10:33:16.000Z,whypad: RT Pierre_Proudhon: Our dreams are nightmares of Brexit and fascist politicians #FuckBrexit  RemainingK… https://t.co/9PEKX07m6v,['fuckbrexit']
860144128000221184,780840449963532160,positive,remain,2017-05-04T14:48:35.000Z,ROCHERRY: RT Pierre_Proudhon: Voter apathy is the best friend of Brexit… #ToriesOut #stopbrexit #fuckbrexit  Re… https://t.co/2d7pcsZyPi,['fuckbrexit']
860158105602150400,780840449963532160,negative,other,2017-05-04T15:44:07.000Z,ROCHERRY: RT Pierre_Proudhon: Our dreams are nightmares of Brexit and fascist politicians #FuckBrexit  Remainin… https://t.co/NnoJLQhr1c,['fuckbrexit']
860222056151089152,780840449963532160,negative,other,2017-05-04T19:58:14.000Z,valerimelnyczuk: RT Pierre_Proudhon: Our dreams are nightmares of Brexit and fascist politicians #FuckBrexit  R… https://t.co/NnoJLQhr1c,['fuckbrexit']
860384395152281600,780840449963532160,positive,remain,2017-05-05T06:43:19.000Z,cats2home: RT Pierre_Proudhon: Voter apathy is the best friend of Brexit… #ToriesOut #stopbrexit #fuckbrexit  R… https://t.co/2d7pcsZyPi,['fuckbrexit']
864595442193104896,4919901107,negative,leave,2017-05-16T21:36:31.000Z,@Annabellas_CMK Is there no way we can walk back Brexit? #fuckbrexit,['fuckbrexit']
866037930615242752,23358621,neutral,remain,2017-05-20T21:08:27.000Z,"Out of interest, how many #Remain voters have left the UK as a result of #Brexit? I wanna leave but weighing up options #fuckbrexit",['fuckbrexit']
866206805113925632,2358364741,positive,other,2017-05-21T08:19:30.000Z,"I dare ANYONE who thinks #brexit will be good for the uk to read this.

Please RT, I don't want anyone saying nobody told them.

#fuckbrexit https://t.co/n5iJB9VpcW",['fuckbrexit']
867709568096366592,2251030667,negative,remain,2017-05-25T11:50:56.000Z,@CloughOlive @remainstayeu Can confirm this is True. Stansted has already lost 50 new built planes due to #brexit. #fuckbrexit,['fuckbrexit']
867832766355783680,21186503,negative,other,2017-05-25T20:00:29.000Z,"Ah, the Brexit bit. This is where I get angry. #FuckBrexit #AndTheHorseItRodeInOn",['fuckbrexit']
871116222821261312,81429690,negative,other,2017-06-03T21:27:46.000Z,"@mikegalsworthy @BestForBritain Hard brexit
#fuckBrexit",['fuckbrexit']
871318056831774720,81429690,positive,leave,2017-06-04T10:49:47.000Z,"@sidrufdiamond Got load of comment like ""fuck brexit, I'm up for that"" and telling me I was awesome #fuckbrexit",['fuckbrexit']
874677052707876864,747510520580804608,positive,leave,2017-06-13T17:17:14.000Z,@RaheemKassam @Nigel_Farage Great news! More remainers is what we need #fuckbrexit,['fuckbrexit']
874698761922121728,1635187676,negative,remain,2017-06-13T18:43:30.000Z,London could lose EU euro clearing role. Another reason that brexit is totally fucking stupid. #FuckBrexit https://t.co/O5QfclohmH,['fuckbrexit']
875072014591156224,747510520580804608,positive,other,2017-06-14T19:26:40.000Z,@WestmonsterUK @LeaveEUOfficial Good news for Britain #fuckbrexit,['fuckbrexit']
876365173199687680,19551977,negative,other,2017-06-18T09:05:14.000Z,"@jeremycorbyn Brexit for the none, it's total madness #fuckbrexit",['fuckbrexit']
