t_id,user_id,t_sentiment,t_stance,t_date,t_text,hashtags
877815140363710464,181245414,negative,other,2017-06-22T09:06:53.000Z,The day our awful Tory 'government' swapped austerity for Brexit poverty. #BinBrexit #Brexitpoverty https://t.co/UDRoxmVZlH,['binbrexit']
877838249720397824,181245414,negative,other,2017-06-22T10:38:42.000Z,Time to stop pissing about! Stand up against BREXIT! @campbellclaret @ChukaUmunna @DanJarvisMP @johnmcdonnellMP #BinBrexit #Corbyn https://t.co/f13gdLtmzC,['binbrexit']
877902934112993280,181245414,positive,other,2017-06-22T14:55:44.000Z,'Britain's Brexit Rethink' Go convince a Brexiteer! @campbellclaret @JolyonMaugham @acgrayling @JamesMelville #BinBrexit #Brexitpoverty https://t.co/lkZMGY8Ngk,['binbrexit']
878011213694750720,832342008157052928,positive,other,2017-06-22T22:06:00.000Z,"We keep repeating ourselves with good reason. Brexit will make us poorer, so says the Governor of the Bank of England. #BinBrexit https://t.co/00ouEE5u2M",['binbrexit']
878519680885043200,181245414,neutral,remain,2017-06-24T07:46:28.000Z,Can Brexit be stopped? You bet it can...it will NEVER HAPPEN! #BinBrexit #Brexitpoverty https://t.co/qWTl0M18Y9,['binbrexit']
879949242193805312,181245414,neutral,leave,2017-06-28T06:27:02.000Z,"Jezza says #Labour ""..will deliver Brexit for the many"" This is bollocks..any Brexit will deliver #Brexitpoverty..'for the many'. #BinBrexit",['binbrexit']
879976161127936000,181245414,neutral,remain,2017-06-28T08:14:00.000Z,Brexit? It won't happen! #BinBrexit https://t.co/bhK4X7dwR2,['binbrexit']
879993107055562752,181245414,negative,remain,2017-06-28T09:21:20.000Z,Hammond wants to limit Brexit damage. Err.. explain why we should entertain ANYTHING that would damage us? Politics of the mad! #BinBrexit,['binbrexit']
881419076328927232,181245414,positive,other,2017-07-02T07:47:38.000Z,#Labour inhabits same skin as the Tories...or is it prepared to stand up against Brexit? Right now Labour #Brexitpoverty beckons! #BinBrexit https://t.co/NuxuRe8KLc,['binbrexit']
881428832288460800,181245414,positive,other,2017-07-02T08:26:24.000Z,If it's Brexit Labour he has only a slim chance. #Labour #BinBrexit https://t.co/xYpSiivVqs,['binbrexit']
881836874448461824,1413476486,negative,remain,2017-07-03T11:27:49.000Z,stop #tories' brexit stop #labour brexit #stopbrexit #binbrexit #remain https://t.co/eiIijGMNZm,['binbrexit']
881885070864285696,181245414,positive,other,2017-07-03T14:39:20.000Z,"Brexit, a word I wish I had never heard! Soon be gone tho! #BinBrexit",['binbrexit']
882493043441643520,3338302007,neutral,other,2017-07-05T06:55:12.000Z,"@dontbrexitfixit @alihinspain At the moment I would happily accept ""Kicked into the long grass and forgotten about only to be discovered by the mower Brexit""
#binbrexit",['binbrexit']
882511576770768896,30275326,negative,remain,2017-07-05T08:08:50.000Z,"@Keir_Starmer It's Brexit, hun, #BinBrexit now and keep what's left to salvage. Enough parties will think UK unreliable and leave no matter what",['binbrexit']
883233621196374016,181245414,negative,remain,2017-07-07T07:57:59.000Z,"As rubble of crumbling Brexit mounts just wait, there'll be a rush of politicians saying they knew all along that it was wrong #BinBrexit",['binbrexit']
883325833183735808,181245414,negative,remain,2017-07-07T14:04:24.000Z,"'Ere we go, 'ere we go, 'ere we go! Luv Brexit, eh? We are SO STUPID! #BinBrexit #CrumblingBrexit https://t.co/hpqxmFjyOd",['binbrexit']
883329967983124480,181245414,positive,other,2017-07-07T14:20:50.000Z,"The sheer pointlessness, stupidity of Brexit perfectly personified by the anachronistic image of Rees-Mogg! Heaven preserve us! #BinBrexit https://t.co/aJS5LaXXdM",['binbrexit']
883764352247095296,1863001507,positive,other,2017-07-08T19:06:55.000Z,"@garvanwalshe You cannot be serious. What kind of benefits means people should have voted for; should still support costly Brexit?  Still time, #BinBrexit",['binbrexit']
883986543710482432,181245414,positive,other,2017-07-09T09:49:50.000Z,Is #Corbyn just waiting for the Tory melt down before he reveals his true colours on Brexit - or do we already know them? #Labour #BinBrexit,['binbrexit']
884300507547922432,181245414,negative,remain,2017-07-10T06:37:25.000Z,May knows her beloved party going to oust her. Mischief time? Say Brexit is a crap idea! Nah! Hasn't the character! #TheresaMay #BinBrexit,['binbrexit']
884322880967913472,181245414,neutral,remain,2017-07-10T08:06:19.000Z,Brexit effect: Food manufacturers shrinking their sizes. You are being conned! You're actually getting less and paying more. DOH! #BinBrexit,['binbrexit']
884324406402711552,181245414,neutral,other,2017-07-10T08:12:23.000Z,The Brexit effect devaluation in the £? 16%! Did you see that on the side of the bus? #BinBrexit,['binbrexit']
884337585019121664,181245414,negative,other,2017-07-10T09:04:45.000Z,As every day ticks by our economy is being eroded. It will take decades to repair the Brexit damage. #BinBrexit,['binbrexit']
884351058046275584,72684950,negative,remain,2017-07-10T09:58:17.000Z,People's March Hacked (Balls to Brexit) #BallstoBrexit #BolloxtoBrexit #BrexitISBollox #StopBrexit #BinBrexit   https://t.co/urM40YWaxp,['binbrexit']
884433101828608000,181245414,negative,remain,2017-07-10T15:24:18.000Z,Utter pointlessness. Which is what Brexit is... UTTERLY POINTLESS! #BinBrexit https://t.co/YOU5syShux,['binbrexit']
885373838590193664,181245414,negative,other,2017-07-13T05:42:27.000Z,In Derby children of 15 have the reading age of 11 &amp; our government focus? Distraction Brexit. This way to 3rd world! #BinBrexit,['binbrexit']
885376443445899264,181245414,negative,other,2017-07-13T05:52:48.000Z,Brexit the ultimate in distraction politics and #Labour are playing along. WHY? Meanwhile the country can go hang? Unfathomable! #BinBrexit,['binbrexit']
885512245958119424,181245414,negative,other,2017-07-13T14:52:26.000Z,NO! NO! NO! #Labour MUST reject the Great Repeal Bill! If it doesn't it is a  betrayal of the electorate. Wake up Brexit IS DEAD! #BinBrexit,['binbrexit']
886247731186065408,181245414,negative,remain,2017-07-15T15:34:59.000Z,"Brexodus is a calamity and it's happening now. Brexit is a catastrophe which won't happen, but Brexodus damage will be HUGE! #BinBrexit NOW!",['binbrexit']
886329755095748608,30275326,negative,remain,2017-07-15T21:00:55.000Z,@jeremycorbyn @theresa_may Brexit will make poverty worse. #BinBrexit now!,['binbrexit']
887748525618057216,636188854,neutral,remain,2017-07-19T18:58:36.000Z,Ben Bradshaw: Brexit will Not Happen! https://t.co/cpe0mPakD5 #BINBREXIT,['binbrexit']
889106860011397120,30275326,negative,leave,2017-07-23T12:56:08.000Z,@OwenJones84 5/5 Brexit is for May what the Falkland War was for Thatcher: distraction. STOP playing along-FOCUS! #BinBrexit before there's nothing left!,['binbrexit']
891304842983088128,529558246,neutral,remain,2017-07-29T14:30:08.000Z,Utterly delusional thinking from Gisela Stuart  : Brexit belongs to the British people https://t.co/yODb8bRPPd via @BrexitCentral #BinBrexit,['binbrexit']
891627903745744896,529558246,negative,remain,2017-07-30T11:53:52.000Z,You are right and Hoey is wrong. There is no mandate of any kind for brexit. We must stop it. #BinBrexit https://t.co/k92p5HOjX2,['binbrexit']
891723535126863872,72684950,negative,remain,2017-07-30T18:13:52.000Z,"NHS vs Brexit ""no brainier"" #StopBrexitHour #StopBrexit #ExitFromBrexit #ExitBrexit #BinBrexit @acgrayling https://t.co/gqLGRDxvVk",['binbrexit']
893846279767244800,874093044252917760,negative,leave,2017-08-05T14:48:54.000Z,"@LiveInUKLoveEU @acgrayling Much like Brexit means Brexit, so bunch of misguided fools means bunch of misguided fools... 
#binbrexit",['binbrexit']
894693126455140352,747901327536172928,negative,other,2017-08-07T22:53:58.000Z,"May's sycophancy with autocrats and fools is sickening to behold
And all on account of #Brexit
We need to #BinBrexit now https://t.co/9176KsRYPO",['binbrexit']
897937000929542144,636188854,negative,remain,2017-08-16T21:43:58.000Z,@JeanneBartram @brexit_sham Utter futile disaster- #BINBREXIT,['binbrexit']
898606758171729920,72684950,neutral,remain,2017-08-18T18:05:21.000Z,Then Brexit #StopBrexit #ExitBrexit #BinBrexit,['binbrexit']
900464942683492352,636188854,negative,other,2017-08-23T21:09:06.000Z,"@labourlewis We don't need another referendum: we need to acknowledge Brexit is an unmitigated disaster, even before it happens! #BINBREXIT",['binbrexit']
901755688329912320,912123126,negative,remain,2017-08-27T10:38:04.000Z,Acknowledging a softer approach to #brexit is needed = admitting it's a flawed concept. #binbrexit #remain https://t.co/VG5y9PwV69,['binbrexit']
902977218921582592,454797366,neutral,remain,2017-08-30T19:32:00.000Z,"@johnredwood @europe_not_EU Exactly because Brexit is not going to happen. Merci, danke, grazia, good-night. #binbrexit #nobrexit #bettertogether #remian",['binbrexit']
903357825270853632,52045268,neutral,other,2017-08-31T20:44:23.000Z,"UK’s approach to Brexit is ‘nostalgic and unrealistic’, says EU negotiator #Binbrexit #Novouk #NewUk #Brexitmayhem  https://t.co/rMgNP33CYv",['binbrexit']
907892921722122240,636188854,negative,remain,2017-09-13T09:05:15.000Z,@Keir_Starmer Can't we just admit Brexit is a wholesale disaster before it has even started and #BINBREXIT!!,['binbrexit']
911914258321076224,30275326,negative,leave,2017-09-24T11:24:36.000Z,@LBC I am worried that they ultimately still want to go through with Brexit. #BinBrexit now and work on the actual problems that made ppl unhappy,['binbrexit']
915885430171631616,112553631,negative,other,2017-10-05T10:24:37.000Z,@jonworth @Geoelte_Spinne Two forces: businesses ditch #Brexit appeasement 2. grey suits weigh @conservatives future. A Tory #BinBrexit coup.. wrongfooting @uklabour😢,['binbrexit']
918176091373735936,112553631,neutral,other,2017-10-11T18:06:53.000Z,UK and EU formally inform WTO of post-Brexit tariff quota plan &lt;Another didactic exercise in #BinBrexit  https://t.co/WIJ0a5f5Z1,['binbrexit']
918214868829900800,112553631,neutral,other,2017-10-11T20:40:58.000Z,@Jude_KD Surely @Conservatives giving up before engaging in serious negotiations ‘cos they are beat. Only viable #Brexit deal is #BinBrexit,['binbrexit']
918238505532317696,863870950756028416,neutral,remain,2017-10-11T22:14:54.000Z,I'm starting to think Theresa May is a saboteur trying to make such a shambles of Brexit that the whole topic gets binned? #BinBrexit https://t.co/ybUNMXbDUr,['binbrexit']
918361640101400576,181245414,positive,remain,2017-10-12T06:24:11.000Z,Brexit? Like trying to unscramble eggs. Any deal impossible in time because of the complexity. It has to be ditched #binBrexit,['binbrexit']
918396581627473920,112553631,negative,other,2017-10-12T08:43:02.000Z,In brief: there’s either ‘hard Brexit’ or no Brexit at all. &lt;Some if us hv known this for over a year. #BinBrexit https://t.co/ZQt4EILKgJ,['binbrexit']
919645867635892224,2875736931,negative,remain,2017-10-15T19:27:15.000Z,".@theresa_may some food for thought 
It's time to stop #Brexit
#BinBrexit https://t.co/j7BbAWOx5W",['binbrexit']
921128162808832000,366982255,neutral,leave,2017-10-19T21:37:22.000Z,"In which HM Treasury, aka UK Govt ‘talks down’ #Brexit

Let’s take back control, let the Govt follow its own advisors, and #BinBrexit https://t.co/yFufYRGQdb",['binbrexit']
921627393906929664,863870950756028416,neutral,remain,2017-10-21T06:41:08.000Z,Negotiation School Rule 1. Don’t show your hand. #Brexit #BinBrexit #BrexitShambles https://t.co/rSKKsRvZ1L,['binbrexit']
922015997313339392,788305837915770880,positive,other,2017-10-22T08:25:18.000Z,"#Labour demands changes to #Brexit repeal bill. @Keir_Starmer’s 6 proposals are good, but there’s a 7th: #BinBrexit  https://t.co/cyY9FxQ5zj",['binbrexit']
922334500218200064,142012778,neutral,other,2017-10-23T05:30:55.000Z,"Read this thread &amp; see both the mysoginy of the #Brexit cheerleaders, &amp; spineless accolites, &amp; press the case to #binbrexit with #GETwo2017 https://t.co/QtvGkr9hid",['binbrexit']
923597448513245184,454797366,neutral,other,2017-10-26T17:09:25.000Z,one way or another there will be a final say in parliamnet or on the street. Brexit will not pass. #binbrexit #nobrexit https://t.co/QAPZtTLNiO,['binbrexit']
923599619715747840,454797366,negative,remain,2017-10-26T17:18:03.000Z,"He, like all Brexit voters, is an idiot. #nobrexit #binbrexit https://t.co/k9T6fDzLZ7",['binbrexit']
924674559672049664,454797366,negative,leave,2017-10-29T16:29:29.000Z,@guardiannews It will be once we bin Brexit. I’d say by the time the clocks go forward Brexit will be dead and buried. #binbrexit,['binbrexit']
925816983458844672,112553631,negative,other,2017-11-01T20:09:04.000Z,"@Doozy_45 That should take long. Answer screamingly obvious, according to SoS UK will be worse off i.e. Brexit waste of public monies #BinBrexit",['binbrexit']
926043947046227968,2687682974,positive,other,2017-11-02T11:10:56.000Z,Some good news then @JuliaHB1 .......... A @UKLabour government &amp; out of the insanity of Brexit. Sounds perfect 😀 #BinBrexit #BinTheTories https://t.co/DqZ6ChjEJK,['binbrexit']
927864474802954240,454797366,positive,other,2017-11-07T11:45:04.000Z,@KeohaneDan hope they had copies of Brexit and Ireland by @tconnellyRTE with them. What's good for Ireland is good for everyone #binbrexit,['binbrexit']
928294561700548608,454797366,negative,other,2017-11-08T16:14:05.000Z,@almurray @DBWLondon @bobfrombrockley Brexit and Ireland by @tconnellyRTE gives chapter and verse on the impact on everything from fish to face cream and the news is exclusively bad. #binbrexit,['binbrexit']
928320361053245440,349869299,neutral,remain,2017-11-08T17:56:36.000Z,Does this include Brexit too? #BinBrexit #BrexitBin #VoteIn https://t.co/gLHySLfsYZ,['binbrexit']
928335668538937344,454797366,neutral,remain,2017-11-08T18:57:25.000Z,@ChukaUmunna when is Labour going to do the inevitable and say No Brexit. It's only a matter of time so may as well do it now. #nobrexit #binbrexit,['binbrexit']
928731715383721984,636188854,positive,other,2017-11-09T21:11:10.000Z,"@Channel4News Some Tory woman wittering on about how she’s told other EU countries about massive support for Brexit among govt MPs! No- the issue rips the party apart, as it does the country. Great desire to #BINBREXIT!! 💙💛🇪🇺",['binbrexit']
928915323566350336,112553631,negative,remain,2017-11-10T09:20:46.000Z,Oh no. Quite the reverse..#Brexit studies open up the ‘you @Conservatives were lying to the country to trample on the vast majority of decent law-abiding people’ thread #binbrexit https://t.co/gVFZHwg6vg,['binbrexit']
930779562618900480,69558002,neutral,remain,2017-11-15T12:48:35.000Z,@mrmarkf @withorpe @nickynoo007 Digs around in bins. Talking of bins: that’s where Brexit should be. #BinBrexit ##StopBrexit,['binbrexit']
932705723418542080,636188854,positive,other,2017-11-20T20:22:27.000Z,"@GuitarMoog #BINBREXIT and banish youthful naïve types like @HenryNewman, who know zilch about real life and the seven yrs of suffering already endured by the great British public, connect into Brexit!",['binbrexit']
936158350622035968,259943456,positive,remain,2017-11-30T09:01:58.000Z,"If May stands up to Trump we'd back her, the 'special relationship' is over. Anything goes now, so #BinBrexit. Take the heat Tereeza, you'll feel better for it. #Brexit https://t.co/ETssWhZqsM",['binbrexit']
936686477777530880,3965004861,positive,other,2017-12-01T20:00:33.000Z,No Brexit for me tonight mom's opening nice Chablis and having my Dreamies purrfect 😻#catsoftwitter #sheba #FridayFeeling #binbrexit https://t.co/tFXF2KEzLb,['binbrexit']
941572974687215616,2687682974,negative,remain,2017-12-15T07:37:45.000Z,"More interested in votes than you are interested in truth and democracy then @frankfieldteam. Brexit is a serious mistake, it is bad for our country and our economy. #binbrexit https://t.co/Unfvqjr6qF",['binbrexit']
