,t_id,user_id,t_sentiment,t_stance,t_date,t_text,hashtags
2014132,1069183341449089024,306821032,negative,other,2018-12-02T10:55:47.000Z,"#standup4brexiit parliamentary consensus fr both the Conservatives &amp; Labour to be seen to be respecting the referendum result, Brexit would have to mean UK out of BOTH the single market &amp; the customs union. 
Don't accept any old deal just to end this limbo
https://t.co/atY3vmDNVb",['standup4brexiit']
3172303,1084569783570522112,306821032,neutral,other,2019-01-13T21:56:01.000Z,"#standup4brexiit @conservatives @GillianKeegan from the FT re WTO. They've been anti-brexit, so this assessment is to be believed  https://t.co/wMEXx9O11Y",['standup4brexiit']
2014133,1069183341449089024,306821032,negative,other,2018-12-02T10:55:47.000Z,"#standup4brexiit parliamentary consensus fr both the Conservatives &amp; Labour to be seen to be respecting the referendum result, Brexit would have to mean UK out of BOTH the single market &amp; the customs union. 
Don't accept any old deal just to end this limbo
https://t.co/atY3vmDNVb",['standup4brexiit']
1157894,1119904019521126400,306821032,positive,leave,2019-04-21T10:01:39.000Z,"@conservatives @GillianKeegan #standup4brexiit #Brexit 
Another leading Dutch customs specialist recently told parliament the argument behind the backstop is ‘fictitious’, in testimony that was barely reported. https://t.co/S3JuUlSjYA","['brexit', 'standup4brexiit']"
